===/dev/sda===
smartctl 7.5 2025-04-30 r5714 [x86_64-linux-7.0.2-6-pve] (local build)
Copyright (C) 2002-25, Bruce Allen, Christian Franke, www.smartmontools.org

=== START OF INFORMATION SECTION ===
Model Family:     Micron 5100 / 52x0 / 5300 / 5400 SSDs
Device Model:     Micron_5200_MTFDDAK960TDD
Serial Number:    17501DBDA8FB
LU WWN Device Id: 5 00a075 11dbda8fb
Firmware Version: D1MU020
User Capacity:    960,197,124,096 bytes [960 GB]
Sector Sizes:     512 bytes logical, 4096 bytes physical
Rotation Rate:    Solid State Device
Form Factor:      2.5 inches
TRIM Command:     Available, deterministic, zeroed
Device is:        In smartctl database 7.5/5706
ATA Version is:   ACS-3 T13/2161-D revision 5
SATA Version is:  SATA 3.2, 6.0 Gb/s (current: 6.0 Gb/s)
Local Time is:    Fri Jul 10 14:50:54 2026 EEST
SMART support is: Available - device has SMART capability.
SMART support is: Enabled

=== START OF READ SMART DATA SECTION ===
SMART overall-health self-assessment test result: PASSED

SMART Attributes Data Structure revision number: 16
Vendor Specific SMART Attributes with Thresholds:
ID# ATTRIBUTE_NAME          FLAG     VALUE WORST THRESH TYPE      UPDATED  WHEN_FAILED RAW_VALUE
  1 Raw_Read_Error_Rate     0x002f   100   100   050    Pre-fail  Always       -       0
  5 Reallocated_Sector_Ct   0x0032   100   100   001    Old_age   Always       -       0
  9 Power_On_Hours          0x0032   100   100   000    Old_age   Always       -       50065
 12 Power_Cycle_Count       0x0032   100   100   001    Old_age   Always       -       62
170 Reserved_Block_Pct      0x0033   100   100   010    Pre-fail  Always       -       0
171 Program_Fail_Count      0x0032   100   100   000    Old_age   Always       -       0
172 Erase_Fail_Count        0x0032   100   100   001    Old_age   Always       -       0
173 Avg_Block-Erase_Count   0x0032   096   096   000    Old_age   Always       -       282
174 Unexpect_Power_Loss_Ct  0x0032   100   100   000    Old_age   Always       -       59
183 SATA_Int_Downshift_Ct   0x0032   100   100   000    Old_age   Always       -       0
184 End-to-End_Error        0x0032   100   100   000    Old_age   Always       -       0
187 Reported_Uncorrect      0x0032   100   100   000    Old_age   Always       -       0
188 Command_Timeout         0x0032   100   100   000    Old_age   Always       -       152
194 Temperature_Celsius     0x0022   074   060   000    Old_age   Always       -       26 (Min/Max 16/40)
195 Hardware_ECC_Recovered  0x0032   100   100   000    Old_age   Always       -       0
196 Reallocated_Event_Count 0x0032   100   100   000    Old_age   Always       -       0
197 Current_Pending_Sector  0x0032   100   100   000    Old_age   Always       -       0
198 Offline_Uncorrectable   0x0030   100   100   000    Old_age   Offline      -       0
199 UDMA_CRC_Error_Count    0x0032   100   100   000    Old_age   Always       -       0
202 Percent_Lifetime_Remain 0x0030   096   096   001    Old_age   Offline      -       4
206 Write_Error_Rate        0x000e   100   100   000    Old_age   Always       -       0
246 Total_LBAs_Written      0x0032   100   100   000    Old_age   Always       -       613346850262
247 Host_Program_Page_Count 0x0032   100   100   000    Old_age   Always       -       19262064379
248 Bckgnd_Program_Page_Cnt 0x0032   100   100   000    Old_age   Always       -       2697973588
180 Unused_Rsvd_Blk_Cnt_Tot 0x0033   000   000   000    Pre-fail  Always       -       5352
210 RAIN_Success_Recovered  0x0032   100   100   000    Old_age   Always       -       0
211 Integ_Scan_Complete_Cnt 0x0032   100   100   000    Old_age   Always       -       169
212 Integ_Scan_Folding_Cnt  0x0032   100   100   000    Old_age   Always       -       206

===/dev/sdb===
smartctl 7.5 2025-04-30 r5714 [x86_64-linux-7.0.2-6-pve] (local build)
Copyright (C) 2002-25, Bruce Allen, Christian Franke, www.smartmontools.org

=== START OF INFORMATION SECTION ===
Model Family:     Micron 5100 / 52x0 / 5300 / 5400 SSDs
Device Model:     Micron_5200_MTFDDAK960TDD
Serial Number:    17501DBDA917
LU WWN Device Id: 5 00a075 11dbda917
Firmware Version: D1MU020
User Capacity:    960,197,124,096 bytes [960 GB]
Sector Sizes:     512 bytes logical, 4096 bytes physical
Rotation Rate:    Solid State Device
Form Factor:      2.5 inches
TRIM Command:     Available, deterministic, zeroed
Device is:        In smartctl database 7.5/5706
ATA Version is:   ACS-3 T13/2161-D revision 5
SATA Version is:  SATA 3.2, 6.0 Gb/s (current: 6.0 Gb/s)
Local Time is:    Fri Jul 10 14:50:54 2026 EEST
SMART support is: Available - device has SMART capability.
SMART support is: Enabled

=== START OF READ SMART DATA SECTION ===
SMART overall-health self-assessment test result: PASSED

SMART Attributes Data Structure revision number: 16
Vendor Specific SMART Attributes with Thresholds:
ID# ATTRIBUTE_NAME          FLAG     VALUE WORST THRESH TYPE      UPDATED  WHEN_FAILED RAW_VALUE
  1 Raw_Read_Error_Rate     0x002f   100   100   050    Pre-fail  Always       -       0
  5 Reallocated_Sector_Ct   0x0032   100   100   001    Old_age   Always       -       0
  9 Power_On_Hours          0x0032   100   100   000    Old_age   Always       -       50065
 12 Power_Cycle_Count       0x0032   100   100   001    Old_age   Always       -       62
170 Reserved_Block_Pct      0x0033   100   100   010    Pre-fail  Always       -       0
171 Program_Fail_Count      0x0032   100   100   000    Old_age   Always       -       0
172 Erase_Fail_Count        0x0032   100   100   001    Old_age   Always       -       0
173 Avg_Block-Erase_Count   0x0032   095   095   000    Old_age   Always       -       320
174 Unexpect_Power_Loss_Ct  0x0032   100   100   000    Old_age   Always       -       59
183 SATA_Int_Downshift_Ct   0x0032   100   100   000    Old_age   Always       -       0
184 End-to-End_Error        0x0032   100   100   000    Old_age   Always       -       0
187 Reported_Uncorrect      0x0032   100   100   000    Old_age   Always       -       0
188 Command_Timeout         0x0032   100   100   000    Old_age   Always       -       152
194 Temperature_Celsius     0x0022   075   064   000    Old_age   Always       -       25 (Min/Max 16/36)
195 Hardware_ECC_Recovered  0x0032   100   100   000    Old_age   Always       -       0
196 Reallocated_Event_Count 0x0032   100   100   000    Old_age   Always       -       0
197 Current_Pending_Sector  0x0032   100   100   000    Old_age   Always       -       0
198 Offline_Uncorrectable   0x0030   100   100   000    Old_age   Offline      -       0
199 UDMA_CRC_Error_Count    0x0032   100   100   000    Old_age   Always       -       0
202 Percent_Lifetime_Remain 0x0030   095   095   001    Old_age   Offline      -       5
206 Write_Error_Rate        0x000e   100   100   000    Old_age   Always       -       0
246 Total_LBAs_Written      0x0032   100   100   000    Old_age   Always       -       608773174923
247 Host_Program_Page_Count 0x0032   100   100   000    Old_age   Always       -       19119173966
248 Bckgnd_Program_Page_Cnt 0x0032   100   100   000    Old_age   Always       -       5746285022
180 Unused_Rsvd_Blk_Cnt_Tot 0x0033   000   000   000    Pre-fail  Always       -       5352
210 RAIN_Success_Recovered  0x0032   100   100   000    Old_age   Always       -       0
211 Integ_Scan_Complete_Cnt 0x0032   100   100   000    Old_age   Always       -       134
212 Integ_Scan_Folding_Cnt  0x0032   100   100   000    Old_age   Always       -       78

